<?xml version="1.0" encoding="UTF-8"?>
<scientific-paper xmlns="https://github.com/XML-TIM4/ScientificPublications"
 xmlns:xsi="http://www.w3.org/2001/XMLSchema-instance"
 xsi:schemaLocation="https://github.com/XML-TIM4/ScientificPublications file:/D:/ScientificPublications/Backend/data/schemas/ScientificPaper.xsd" language="en" id="IA1yj">
    <metadata>
        <received>2022-05-06</received>
        <revised>2020-09-19</revised>
        <accepted>2021-10-14Z</accepted>
        <version>1.0</version>
        <status>withdrawn</status>
        <category>research-paper</category>
        <keywords>
            <keyword>cDMge0W6HPX1-ik9KtW-2NBDjq5qUfFs3_</keyword>
            <keyword>YM5r512XMizQaWyxh5q5INWvmDDrAaOc0YtlcKtIVsBSK1mc1u</keyword>
        </keywords>
    </metadata>
    <title>CP41A-w1wj3D</title>
    <authors>
        <author id="rX9YzugJ">
            <name>
                <first-name>_keo</first-name>
                <middle-name>qf1rb0X15poxgWZNVf6TL4I4Twb6QEnrAw9d</middle-name>
                <middle-name>UeH0LN</middle-name>
                <last-name>W2meXDmksv54Lm5MRjQWsBrrWwSl8</last-name>
            </name>
            <email>Ú@~V +.ara</email>
            <affiliation>
                <university>PEz4z1k1mqty1DlsN_mukgbeD.hH8W</university>
                <city>FZxUfl</city>
                <state>ga</state>
                <country>aQDzjU_jfwDJ-W</country>
            </affiliation>
        </author>
        <author id="mDYGu4cQyGUin9Am5ARBT">
            <name>
                <first-name>lj-PJzwK..ZKJs74_lPUedhGuO03byrMOM9EvuoLavff4hO</first-name>
                <middle-name>p9mLAoGexgLGm17EM</middle-name>
                <middle-name>f8HY.UlL-MU.6qH_UT8</middle-name>
                <last-name>v-r1kbDQU0OJ-ycZ4Ym8wKVi_X-m02eC4C</last-name>
            </name>
            <email>í0;@g.ofn</email>
            <affiliation>
                <university>wsVZ9.okE</university>
                <city>CF6nImGXlZpWu.4so8gV0i</city>
                <state>C6KlrTcyaPWY2h7qtYEW.B0GG5Ma5EQZSRl</state>
                <country>v-5fJNN8OtjrkCxpudmCZyGNGny3Z4F84</country>
            </affiliation>
        </author>
    </authors>
    <abstract id="yDViFVvTbmivtBJEc">
        <abstract-item title="Purpose">oNlxQ6JGRMBLLFHfcPe881va8</abstract-item>
        <abstract-item title="Methodology">YAaU_1-c7W0jrLaxQFOrEUtxev_lK</abstract-item>
        <abstract-item title="Findings">h</abstract-item>
        <abstract-item title="Originality">Xris_W7lp5SPgNXW9</abstract-item>
    </abstract>
    <content>
        <section id="MYGa29VelXSEVFo">
            <title>WKLhqjN5lsr0fFWo</title>
            <paragraph id="rU8EIJiACeWG">
                <decorator>
                    <bold>
                        <italic>
                            <underline>
                            </underline>
                            <underline>
                            </underline>
                        </italic>
                        <italic>
                            <underline>
                            </underline>
                            <underline>
                            </underline>
                        </italic>
                    </bold>
                    <bold>
                        <italic>
                            <underline>
                            </underline>
                            <underline>
                            </underline>
                        </italic>
                        <italic>
                            <underline>
                            </underline>
                            <underline>
                            </underline>
                        </italic>
                    </bold>
                </decorator>
                <list ordered="false">
                    <list-item>kPEYwg2REQ</list-item>
                    <list-item>OdOmcd41Jk4aIyIyHuiwDZFMg</list-item>
                </list>
            </paragraph>
            <paragraph id="pFJ2y0eeL">
                <figure type="equation" id="UEfy2.is0Bnq">
                    <image>677982717677707986667186698088907065828472658871</image>
                    <image>857577897783817880797674658184827087686866837089867674778688898572676767757279868880888789688379</image>
                </figure>
                <figure type="chart" id="Ny79RAeF">
                    <image>87778970737581886776847265716785738688738972668783817086857865708086676673827766778879888469798190676866</image>
                    <image>81796867857868798270706777807683</image>
                </figure>
            </paragraph>
        </section>
        <section id="M5S6.yabP8XZ">
            <title>hN.p_EfqApcG</title>
            <paragraph id="zj9XVSOtsv84mrWi">
                <decorator>
                    <bold>
                        <underline>
                            <italic>
                            </italic>
                            <italic>
                            </italic>
                        </underline>
                        <italic>
                            <underline>
                            </underline>
                            <underline>
                            </underline>
                        </italic>
                    </bold>
                    <underline>
                        <bold>
                            <italic>
                            </italic>
                            <italic>
                            </italic>
                        </bold>
                        <italic>
                            <bold>
                            </bold>
                            <bold>
                            </bold>
                        </italic>
                    </underline>
                </decorator>
                <figure type="equation" id="bQh-VLgwvu8Czp">
                    <image>736570838590857075827968</image>
                    <image>70848381838082658070728581846865888967748887857084668478687890847886818190877487</image>
                </figure>
            </paragraph>
            <paragraph id="ye">
                <decorator>
                    <bold>
                        <underline>
                            <italic>
                            </italic>
                            <italic>
                            </italic>
                        </underline>
                        <italic>
                            <underline>
                            </underline>
                            <underline>
                            </underline>
                        </italic>
                    </bold>
                    <bold>
                        <underline>
                            <italic>
                            </italic>
                            <italic>
                            </italic>
                        </underline>
                        <italic>
                            <underline>
                            </underline>
                            <underline>
                            </underline>
                        </italic>
                    </bold>
                </decorator>
                <list ordered="false">
                    <list-item>RgRknuxqUZIg4cfr4nJRyosuJAGnU</list-item>
                    <list-item>et43hbt_WBlGBToV9p-opsP-LHN.oFs0Lc3ot9nwntq</list-item>
                </list>
            </paragraph>
        </section>
    </content>
    <references>
        <reference>
            <authors>
                <name>
                    <first-name>MyWfrJIUhq.mg1n</first-name>
                    <middle-name>b5ewiYuUszCL3AAZWQCCvy7En</middle-name>
                    <middle-name>nu-YABgogONZE60qMm7OjweMEuCIn</middle-name>
                    <last-name>K_i04tyHlBrCpa31M9p1hDhPsxe9Qpxy-ew_VdjS4Wb</last-name>
                </name>
                <name>
                    <first-name>n0MaxjIH_0ant.YH03ex0GA1VBfY3wfomHy0S</first-name>
                    <middle-name>E0xJmYtGezFejmtq-76bnG0E4L3N3X5jGF0</middle-name>
                    <middle-name>cKvDH5KChXk0AxBJ2a-o</middle-name>
                    <last-name>PrKs1ZFhI4R5AVTNnga6MR5xxSoHYPyCAHqsy</last-name>
                </name>
            </authors>
            <publication>
                <title>B49AC90tkY782g_yRHafFhNoC</title>
                <year>1205</year>
                <publisher>rpqxXXi7uDdka40hnIu4hQ8TdOQdGv5xpttcg6c4zKXESfQpbsp1rXvfBaRlSD2.g9AkT</publisher>
                <place>G</place>
                <url>iEgdJEI_jpBa</url>
            </publication>
        </reference>
        <reference>
            <authors>
                <name>
                    <first-name>kT7Aj</first-name>
                    <middle-name>o</middle-name>
                    <middle-name>RSb.MYTB</middle-name>
                    <last-name>AbLc8lkNM8T9_lAjGEVjP_4evCL.WIfxM7yGf5IGSLG</last-name>
                </name>
                <name>
                    <first-name>Qvl025G-TVRh79j-B2VJzCrRa15jW4V</first-name>
                    <middle-name>Tu21XALCmGUMCvnkumEKZunk</middle-name>
                    <middle-name>IRx7zW_Rn1lI-cFpLA_1H</middle-name>
                    <last-name>bGqUIucpysXo_omKlWf2jFa</last-name>
                </name>
            </authors>
            <publication>
                <title>ucF5CM.IgcMOi0Cuwxcj4yHHWqMCOz</title>
                <year>809</year>
                <publisher>JWAr06ySegAkF</publisher>
                <place>IN3HHcDT7UgZFzax</place>
                <url>EVNQkFpvLwLEL11nPNjGuA6DUIl</url>
            </publication>
        </reference>
    </references>
</scientific-paper>
