<?xml version="1.0" encoding="UTF-8"?>
<scientific-paper xmlns="https://github.com/XML-TIM4/ScientificPublications"
 xmlns:xsi="http://www.w3.org/2001/XMLSchema-instance"
 xsi:schemaLocation="https://github.com/XML-TIM4/ScientificPublications file:/D:/ScientificPublications/XMLSchemas/ScientificPaper.xsd" language="en" id="">
    <metadata>
        <received>2021-06-14Z</received>
        <revised>2020-03-10Z</revised>
        <accepted>2020-08-05Z</accepted>
        <version>1.0</version>
        <status>uploaded</status>
        <category>research-paper</category>
        <keywords>
            <keyword>gBjYErt7SbwGkjQMPiRQ-eno12</keyword>
            <keyword>v</keyword>
        </keywords>
    </metadata>
    <title>gYz5LPRg.fDxCPZvDkm-eYFs2E_8bq3Vs7bW86-y_di4HFr_kZsuq5Bi-xK_I7iet3d3FoTP_7</title>
    <authors>
        <author id="">
            <name>
                <first-name>M.mJ8Lv5aq0irnN</first-name>
                <middle-name>szOpWlVonEfoMVPOof2xmC3jLM7y6Gw9HH7xQix7j</middle-name>
                <middle-name>bFWzi3Ntu_fm</middle-name>
                <last-name>cotQFAjOAr</last-name>
            </name>
            <email>%$ª@'.r</email>
            <affiliation>
                <university>RC8sI0Cxeb3QDv8W8_XbAJBk7rSQNGE-jd.agH6</university>
                <city>wA1qOUBSyN3HVPXOTNfue0</city>
                <state>oRqL7SdkVvCIz</state>
                <country>e8WXZAyJ9EdGdfiC6.TJ0-ehZZFHeXIN1O4UpGHnh</country>
            </affiliation>
        </author>
        <author id="">
            <name>
                <first-name>lVnDrjmD</first-name>
                <middle-name>sMbuT-zCtFWlSfHUqWa</middle-name>
                <middle-name>SckRDtWrxowu_0CDFY</middle-name>
                <last-name>b1fui-V.3LFgX057iSNzZ-CFt.yJH_P4WPwgqq2qQqV</last-name>
            </name>
            <email>5@K.h</email>
            <affiliation>
                <university>R9b-jMjLmU_NeKYAJ-zFi3FBdMOJC3</university>
                <city>osLL</city>
                <state>uZTuR-Xx1</state>
                <country>UHQTy7mCkrhtR0WpToWiu6rKHKN6</country>
            </affiliation>
        </author>
    </authors>
    <abstract id="">
        <abstract-item title="Purpose">CzD33J1hPViTWPAqYW82p-mBf</abstract-item>
        <abstract-item title="Findings">DaNoaYAMSz7rH</abstract-item>
        <abstract-item title="Social Implications">y</abstract-item>
        <abstract-item title="Implications">ELyou3bBqFqWnzzm</abstract-item>
    </abstract>
    <content>
        <section id="/oi">
            <title>vCdQ3R2EkpFISjVd1</title>
            <paragraph id=" #~">
                <figure type="equation" id="">
                    <image>6985777971898673857571808767746668867878806778797183888389888981857587838588708969737480876985668870866987907586</image>
                    <image>6687816581807875</image>
                </figure>
                <quote>
                    <quote-text>T1KADIxas5jp0cC395gtLJR2izQQ8</quote-text>
                    <publication>
                        <title>yZ7DDR</title>
                        <publisher>j62Ajr2pK46f0ZKXw</publisher>
                        <place>Q2uQwWl_O9Rv</place>
                    </publication>
                </quote>
            </paragraph>
            <paragraph id="">
                <table title="m44MpL" id="Q+://=">
                    <header>
                    </header>
                    <body>
                    </body>
                </table>
                <quote>
                    <quote-text>ZlN12f0as9TQI1rqgOvZA</quote-text>
                    <publication>
                        <title>NhL4K8a</title>
                        <publisher>P7AKE4rofSGKjbS.2LGPsrwQSh.E-150laxyri_7dIiTCBt3c4mT6dMDCLYYv6vE</publisher>
                        <place>Vdij5WAXb82_.0TOKHTOQXxde8VHsJyccT</place>
                    </publication>
                </quote>
            </paragraph>
        </section>
        <section id="">
            <title>iVjS</title>
            <paragraph id="">
                <table title="S" id="">
                    <header>
                    </header>
                    <body>
                    </body>
                </table>
                <decorator>
                    <italic>
                        <underline>
                            <bold>
                            </bold>
                            <bold>
                            </bold>
                        </underline>
                        <bold>
                            <underline>
                            </underline>
                            <underline>
                            </underline>
                        </bold>
                    </italic>
                    <italic>
                        <underline>
                            <bold>
                            </bold>
                            <bold>
                            </bold>
                        </underline>
                        <bold>
                            <underline>
                            </underline>
                            <underline>
                            </underline>
                        </bold>
                    </italic>
                </decorator>
            </paragraph>
            <paragraph id="P:/\!q. #~">
                <figure type="figure" id="">
                    <image>7088887067698968</image>
                    <image>728186726674707089828986718972868273708078717970737089888390888568867986778767748167658775686582738285777279677169857286</image>
                </figure>
                <figure type="equation" id="">
                    <image>77836766758366718187906780698168</image>
                    <image>ZGVmYXVsdA==</image>
                </figure>
            </paragraph>
        </section>
    </content>
    <references>
        <reference>
            <authors>
                <name>
                    <first-name>RMgd</first-name>
                    <middle-name>OisVa36t5HxURaDudf</middle-name>
                    <middle-name>jUWyIS</middle-name>
                    <last-name>uAhinIkiMr9qh.De-p3CSOcl6OLAqH</last-name>
                </name>
                <name>
                    <first-name>Pb4AF01b</first-name>
                    <middle-name>Hs4PINfY6heUo_66iUrMH086HG.9GjOpYUoRU</middle-name>
                    <middle-name>_TtzY0MN1UZY-FnMk-3xUhaX_qzrGXK9BunljStLooD</middle-name>
                    <last-name>dqZHONv8BJc2rCqofS2x5V6iu-lBwVSKXb9kFgO_1mZ5</last-name>
                </name>
            </authors>
            <publication>
                <title>x3pVcSDs7QjpKc7u591cS9l3vwoaJJwpQvL_SLSQ0MNq9LZXb3B88lcG.YdAEWQjyz0IiaRtXTR94sqAua1xG</title>
                <year>370</year>
                <publisher>eZ</publisher>
                <place>ESgXEgzhhYijceLZB-PVoNbiCci7OkvWo4P24G2q_</place>
            </publication>
        </reference>
        <reference>
            <authors>
                <name>
                    <first-name>FPNtjC.ZmlWmiQXxJTwsR</first-name>
                    <middle-name>j_3</middle-name>
                    <middle-name>Npu67NPio-wNqb2d1Oblms7</middle-name>
                    <last-name>P5-rGxHFWWhsn</last-name>
                </name>
                <name>
                    <first-name>hm2oBm_P</first-name>
                    <middle-name>TfdzwMe5B</middle-name>
                    <middle-name>tqISBd1tj</middle-name>
                    <last-name>xrkSrRX1p3GKWgQDUvsnd_C9z</last-name>
                </name>
            </authors>
            <publication>
                <title>odHc9k8015Lrxn</title>
                <year>327</year>
                <publisher>Jw8ZRAwULwiN1ADe10rHonk7OJSAZrQ0_C4_jj.if2i-ogKH</publisher>
                <place>MidzhbfBlrLqsbiX7UcOl6CjQZxH667en</place>
            </publication>
        </reference>
    </references>
</scientific-paper>
